{
  "witness": "did:cid:bagaaiera5i3lobqxncn25lxvqznfiak4gvujojpddjft6ub25ys7xbrbfc5a",
  "witnessedEdge": "edge:example:from-to-trusts",
  "event": "edgeEstablished",
  "sessionId": "session:example:2026-02-19",
  "method": "protocolCeremony",
  "timestamp": "2026-02-19T00:00:00Z",
  "evidence": [
    "https://example.org/evidence/witness/456"
  ]
}
